question|answer
describe: endothelioid|Giant cells are not uncommon, but the endothelioid cells, which are so marked a feature of tuberculous granulation tissue, are practically absent.When syphilis is communicated from one individual to another by contact infection, the condition is spoken of as  acquired syphilis , and the first visible sign of the disease appears at the site of inoculation, and is known as  the primary lesion .Those who have thus acquired the disease may transmit it to their offspring, who are then said to suffer from  inherited syphilis .The Virus of Syphilis.The cause of syphilis, whether acquired or inherited, is the organism, described by Schaudinn and Hoffman, in 1905, under the name of  spirochata pallida  or  spironema pallidum .It is a delicate, thread-like spirilla, in length averaging from 8 to 10 µ and in width about 0.25 µ, and is distinguished from other spirochates by its delicate shape, its dead-white appearance, together with its closely twisted spiral form, with numerous undulations (10 to 26), which are perfectly regular, and are characteristic in that they remain the same during rest and in active movement (Fig.
describe: The Virus of Syphilis|The Virus of Syphilis.The cause of syphilis, whether acquired or inherited, is the organism, described by Schaudinn and Hoffman, in 1905, under the name of  spirochata pallida  or  spironema pallidum .It is a delicate, thread-like spirilla, in length averaging from 8 to 10 µ and in width about 0.25 µ, and is distinguished from other spirochates by its delicate shape, its dead-white appearance, together with its closely twisted spiral form, with numerous undulations (10 to 26), which are perfectly regular, and are characteristic in that they remain the same during rest and in active movement (Fig.36).In a fresh specimen, such as a scraping from a hard chancre suspended in a little salt solution, it shows active movements.The organism is readily destroyed by heat, and perishes in the absence of moisture.
describe: D'Arcy Power|ii., edited by D'Arcy Power and J. Keogh Murphy, Oxford Medical Publications.The Soft Sore, Soft Chancre, or Chancroid.The differential diagnosis of syphilis necessitates the consideration of the  soft sore ,  soft chancre , or  chancroid , which is also a common form of venereal disease, and is due to infection with a virulent pus-forming bacillus, first described by Ducrey in 1889.Ducrey's bacillus occurs in the form of minute oval rods measuring about 1.5 µ in length, which stain readily with any basic aniline dye, but are quickly decolorised by Gram's method.They are found mixed with other organisms in the purulent discharge from the sore, and are chiefly arranged in small groups or in short chains.Soft sores are always contracted by direct contact from another individual, and the incubation period is a short one of from two to five days.
describe: Oxford Medical Publications|ii., edited by D'Arcy Power and J. Keogh Murphy, Oxford Medical Publications.The Soft Sore, Soft Chancre, or Chancroid.The differential diagnosis of syphilis necessitates the consideration of the  soft sore ,  soft chancre , or  chancroid , which is also a common form of venereal disease, and is due to infection with a virulent pus-forming bacillus, first described by Ducrey in 1889.Ducrey's bacillus occurs in the form of minute oval rods measuring about 1.5 µ in length, which stain readily with any basic aniline dye, but are quickly decolorised by Gram's method.They are found mixed with other organisms in the purulent discharge from the sore, and are chiefly arranged in small groups or in short chains.Soft sores are always contracted by direct contact from another individual, and the incubation period is a short one of from two to five days.
describe: The Soft Sore, Soft Chancre|The Soft Sore, Soft Chancre, or Chancroid.The differential diagnosis of syphilis necessitates the consideration of the  soft sore ,  soft chancre , or  chancroid , which is also a common form of venereal disease, and is due to infection with a virulent pus-forming bacillus, first described by Ducrey in 1889.Ducrey's bacillus occurs in the form of minute oval rods measuring about 1.5 µ in length, which stain readily with any basic aniline dye, but are quickly decolorised by Gram's method.They are found mixed with other organisms in the purulent discharge from the sore, and are chiefly arranged in small groups or in short chains.Soft sores are always contracted by direct contact from another individual, and the incubation period is a short one of from two to five days.They are usually situated in the vicinity of the franum, and, in women, about the labia minora or fourchette; they probably originate in abrasions in these situations.
describe: fourchette|They are usually situated in the vicinity of the franum, and, in women, about the labia minora or fourchette; they probably originate in abrasions in these situations.They appear as pustules, which are rapidly converted into small, acutely inflamed ulcers with sharply cut, irregular margins, which bleed easily and yield an abundant yellow purulent discharge.They are devoid of the induration of syphilis, are painful, and nearly always multiple, reproducing themselves in successive crops by auto-inoculation.Soft sores are often complicated by phimosis and balanitis, and they frequently lead to infection of the glands in the groin.The resulting bubo is ill-defined, painful, and tender, and suppuration occurs in about one-fourth of the cases.The overlying skin becomes adherent and red, and suppuration takes place either in the form of separate foci in the interior of the individual glands, or around them; in the latter case, on incision, the glands are found lying bathed in pus.
describe: Condylomata|Condylomata  are more characteristic of syphilis than any other type of skin lesion.They are papules occurring on those parts of the body where the skin is habitually moist, and especially where two skin surfaces are in contact.They are chiefly met with on the external genitals, especially in women, around the anus, beneath large pendulous mamma, between the toes, and at the angles of the mouth, and in these situations their development is greatly favoured by neglect of cleanliness.They present the appearance of well-defined circular or ovoid areas in which the skin is thickened and raised above the surface; they are covered with a white sodden epidermis, and furnish a scanty but very infective discharge.Under the influence of irritation and want of rest, as at the anus or at the angle of the mouth, they are apt to become fissured and superficially ulcerated, and the discharge then becomes abundant and may crust on the surface, forming yellow scabs.At the angle of the mouth the condylomatous patches may spread to the cheek, and when they ulcerate may leave fissure-like scars radiating from the mouth an appearance best seen in inherited syphilis (Fig.
describe: The Affections of the Eyes|The Affections of the Eyes , although fortunately rare, are of great importance because of the serious results which may follow if they are not recognised and treated.Iritis  is the commonest of these, and may occur in one or in both eyes, one after the other, from three to eight months after infection.The patient complains of impairment of sight and of frontal or supraorbital pain.The eye waters and is hypersensitive, the iris is discoloured and reacts sluggishly to light, and there is a zone of ciliary congestion around the cornea.The appearance of minute white nodules or flakes of lymph at the margin of the pupil is especially characteristic of syphilitic iritis.When adhesions have formed between the iris and the structures in relation to it, the pupil dilates irregularly under atropin.
describe: Serum Diagnosis Wassermann Reaction|Serum Diagnosis Wassermann Reaction.Wassermann found that if an extract of syphilitic liver rich in spirochates is mixed with the serum from a syphilitic patient, a large amount of complement is fixed.The application of the test is highly complicated and can only be carried out by an expert pathologist.For the purpose he is supplied with from 5 c.c.to 10 c.c.of the patient's blood, withdrawn under aseptic conditions from the median basilic vein by means of a serum syringe, and transferred to a clean and dry glass tube.
describe: The Administration of Mercury|The Administration of Mercury.The success of the arsenical preparations has diminished the importance of mercury in the treatment of syphilis, but it is still used to supplement the effect of the injections.The amount of mercury to be given in any case must be proportioned to the idiosyncrasies of the patient, and it is advisable, before commencing the treatment, to test his urine and record his body-weight.The small amount of mercury given at the outset is gradually increased.If the body-weight falls, or if the gums become sore and the breath foul, the mercury should be stopped for a time.If salivation occurs, the drinking of hot water and the taking of hot baths should be insisted upon, and half-dram doses of the alkaline sulphates prescribed.
describe: grey powder|This was for long the most popular method in this country, the preparation usually employed being grey powder, in pills or tablets, each of which contains one grain of the powder.Three of these are given daily in the first instance, and the daily dose is increased to five or even seven grains till the standard for the individual patient is arrived at.As the grey powder alone sometimes causes irritation of the bowels, it should be combined with iron, as in the following formula: Hydrarg.c. cret.gr.1; ferri sulph.As the grey powder alone sometimes causes irritation of the bowels, it should be combined with iron, as in the following formula: Hydrarg.c. cret.gr.1; ferri sulph.exsiccat.gr.
describe: The General Health|The General Health.The patient must lead a regular life and cultivate the fresh-air habit, which is as beneficial in syphilis as in tuberculosis.Anamia, malaria, and other sources of debility must receive appropriate treatment.The diet should be simple and easily digested, and should include a full supply of milk.Alcohol is prohibited.The excretory organs are encouraged to act by the liberal drinking of hot water between meals, say five or six tumblerfuls in the twenty-four hours.
describe: The Relations of Syphilis to Marriage|The Relations of Syphilis to Marriage.Before the introduction of the Ehrlich-Hata treatment no patient was allowed to marry until three years had elapsed after the disappearance of the last manifestation.While marriage might be entered upon under these conditions without risk of the husband infecting the wife, the possibility of his conveying the disease to the offspring cannot be absolutely excluded.It is recommended, as a precautionary measure, to give a further mercurial course of two or three months' duration before marriage, and an intravenous injection of an arsenical preparation.Intermediate Stage.After the dying away of the secondary manifestations and before the appearance of tertiary lesions, the patient may present certain symptoms which Hutchinson called  reminders .
describe: Tertiary Syphilis|Tertiary Syphilis.While the manifestations of primary and secondary syphilis are common, those of the tertiary period are by comparison rare, and are observed chiefly in those who have either neglected treatment or who have had their powers of resistance lowered by privation, by alcoholic indulgence, or by tropical disease.It is to be borne in mind that in a certain proportion of men and in a larger proportion of women, the patient has no knowledge of having suffered from syphilis.Certain slight but important signs may give the clue in a number of cases, such as irregularity of the pupils or failure to react to light, abnormality of the reflexes, and the discovery of patches of leucoplakia on the tongue, cheek, or palate.The  general character of tertiary manifestations  may be stated as follows: They attack by preference the tissues derived from the mesoblastic layer of the embryo the cellular tissue, bones, muscles, and viscera.They are often localised to one particular tissue or organ, such, for example, as the subcutaneous cellular tissue, the bones, or the liver, and they are rarely symmetrical.
describe: spirochates|It is a delicate, thread-like spirilla, in length averaging from 8 to 10 µ and in width about 0.25 µ, and is distinguished from other spirochates by its delicate shape, its dead-white appearance, together with its closely twisted spiral form, with numerous undulations (10 to 26), which are perfectly regular, and are characteristic in that they remain the same during rest and in active movement (Fig.36).In a fresh specimen, such as a scraping from a hard chancre suspended in a little salt solution, it shows active movements.The organism is readily destroyed by heat, and perishes in the absence of moisture.It has been proved experimentally that it remains infective only up to six hours after its removal from the body.Noguchi has succeeded in obtaining pure cultures from the infected tissues of the rabbit.Noguchi has made an emulsion of dead spirochates which he calls  luetin , and which gives a specific reaction resembling that of tuberculin in tuberculosis, a papule or a pustule forming at the site of the intra-dermal injection.It is said to be most efficacious in the tertiary and latent forms of syphilis, which are precisely those forms in which the diagnosis is surrounded with difficulties.ACQUIRED SYPHILIS In the vast majority of cases, infection takes place during the congress of the sexes.Delicate, easily abraded surfaces are then brought into contact, and the discharge from lesions containing the virus is placed under favourable conditions for conveying the disease from one person to the other.In the male the possibility of infection taking place is increased if the virus is retained under cover of a long and tight prepuce, and if there are abrasions on the surface with which it comes in contact.The frequency with which infection takes place on the genitals during sexual intercourse warrants syphilis being considered a venereal disease, although there are other ways in which it may be contracted.
describe: Choroiditis|Choroiditis  and  retinitis  may also occur, and leave permanent changes easily recognised on examination with the ophthalmoscope.Among the rarer and more serious lesions of the inherited disease may be mentioned gummatous disease in the  larynx and trachea , attended with ulceration and resulting in stenosis; and lesions of the  nervous system  which may result in convulsions, paralysis, or dementia.In a limited number of cases, about the period of puberty there may develop  deafness , which is usually bilateral and may become absolute.Changes in the Permanent Teeth.These affect specially the upper central incisors, which are dwarfed and stand somewhat apart in the gum, with their free edges converging towards one another.They are tapering or peg-shaped, and present at their cutting margin a deep semilunar notch.
describe: condylomata|It is readily found in the mucous patches and condylomata of the secondary period.It is best stained by Giemsa's method, and its recognition is greatly aided by the use of the ultra-microscope.The spirochate has been demonstrated in every form of syphilitic lesion, and has been isolated from the blood with difficulty and from lymph withdrawn by a hollow needle from enlarged lymph glands.The saliva of persons suffering from syphilitic lesions of the mouth also contains the organism.In tertiary lesions there is greater difficulty in demonstrating the spirochate, but small numbers have been found in the peripheral parts of gummata and in the thickened patches in syphilitic disease of the aorta.Noguchi and Moore have discovered the spirochate in the brain in a number of cases of general paralysis of the insane.The primary lesion may take the form of condylomata.Indurated œdema, with brownish-red or livid discoloration of one or both labia, is diagnostic of syphilis.The hard chancre is usually solitary, but sometimes there are two or more; when there are several, they are individually smaller than the solitary chancre.It is the exception for a hard chancre to leave a visible scar, hence, in examining patients with a doubtful history of syphilis, little reliance can be placed on the presence or absence of a scar on the genitals.When the primary lesion has taken the form of an open ulcer with purulent discharge, or has sloughed, there is a permanent scar.Infection of the adjacent lymph glands  is usually found to have taken place by the time the primary lesion has acquired its characteristic induration.
describe: choroiditis|"While a considerable number of syphilitic children grow up without showing any trace of their syphilitic inheritance, the majority retain throughout life one or more of the following characteristics, which may therefore be described as  permanent signs of the inherited disease : Dwarfing of stature from interference with growth at the epiphysial junctions; the forehead low and vertical, and the parietal and frontal eminences unduly prominent; the bridge of the nose sunken and rounded; radiating scars at the angles of the mouth; perforation or destruction of the hard palate; Hutchinson's teeth; opacities of the cornea from antecedent keratitis; alterations in the fundus oculi from choroiditis; deafness; depressed scars or nodes on the bones from previous gummata; ""sabre-blade"" or other deformity of the tibia.The Contagiousness of Inherited Syphilis.In 1837, Colles of Dublin stated his belief that, while a syphilitic infant may convey the disease to a healthy wet nurse, it is incapable of infecting its own mother if nursed by her, even although she may never have shown symptoms of the disease.This doctrine, which is known as  Colles' law , is generally accepted in spite of the alleged occurrence of occasional exceptions.The older the child, the less risk there is of its communicating the disease to others, until eventually the tendency dies out altogether, as it does in the tertiary period of acquired syphilis.It should be added, however, that the contagiousness of inherited syphilis is denied by some observers, who affirm that, when syphilitic infants prove infective, the disease has been really acquired at or soon after birth."
describe: Colles of Dublin|In 1837, Colles of Dublin stated his belief that, while a syphilitic infant may convey the disease to a healthy wet nurse, it is incapable of infecting its own mother if nursed by her, even although she may never have shown symptoms of the disease.This doctrine, which is known as  Colles' law , is generally accepted in spite of the alleged occurrence of occasional exceptions.The older the child, the less risk there is of its communicating the disease to others, until eventually the tendency dies out altogether, as it does in the tertiary period of acquired syphilis.It should be added, however, that the contagiousness of inherited syphilis is denied by some observers, who affirm that, when syphilitic infants prove infective, the disease has been really acquired at or soon after birth.There is general agreement that the subjects of inherited syphilis cannot transmit the disease by inheritance to their offspring, and that, although they very rarely acquire the disease  de novo , it is possible for them to do so.Prognosis of Inherited Syphilis.
describe: Endothelioma|CLASSIFICATION OF TUMOURS: I. Connective-tissue tumours:     (1)  Innocent :  Lipoma ,  Xanthoma ,  Chondroma ,  Osteoma ,      Odontoma ,  Fibroma ,  Myxoma ,  Endothelioma , etc.; (2)      Malignant :  Sarcoma  II.Epithelial tumours: (1)  Innocent :      Papilloma ,  Adenoma ,  Cystic Adenoma ; (2)  Malignant :      Epithelioma ,  Glandular Cancer ,  Rodent Cancer ,  Melanotic     Cancer  III.Dermoids IV.Teratoma.Cysts:  Retention ,      Exudation ,  Implantation ,  Parasitic ,  Lymphatic or Serous .Endotheliomas  take origin from the endothelium of lymph vessels and blood vessels, and serous cavities.They show great variation in type, partly because of the number of different kinds of endothelium from which they are derived, and partly because the new connective tissue which is formed is liable to undergo transformation into other tissues.They may be soft or hard, solid or cystic, diffuse or circumscribed; they grow very slowly, and are almost always innocent, although recurrence has been occasionally observed.Cases of multiple endotheliomata of the skin have recently been described by Wise.Angioma ,  lymphangioma , and  neuroma  are described with the disease of the individual tissues.MALIGNANT CONNECTIVE-TISSUE TUMOURS SARCOMA The term sarcoma is applied to any connective-tissue tumour which exhibits malignant characters.
describe: Cystic Adenoma|Epithelial tumours: (1)  Innocent :      Papilloma ,  Adenoma ,  Cystic Adenoma ; (2)  Malignant :      Epithelioma ,  Glandular Cancer ,  Rodent Cancer ,  Melanotic     Cancer  III.Dermoids IV.Teratoma.Cysts:  Retention ,      Exudation ,  Implantation ,  Parasitic ,  Lymphatic or Serous .Ganglion.For the histology of tumours the reader is referred to a text-book of pathology.
describe: Glandular Cancer|Epithelial tumours: (1)  Innocent :      Papilloma ,  Adenoma ,  Cystic Adenoma ; (2)  Malignant :      Epithelioma ,  Glandular Cancer ,  Rodent Cancer ,  Melanotic     Cancer  III.Dermoids IV.Teratoma.Cysts:  Retention ,      Exudation ,  Implantation ,  Parasitic ,  Lymphatic or Serous .Ganglion.For the histology of tumours the reader is referred to a text-book of pathology.
describe: Bland Sutton|An odontoma is composed of dental tissues in varying proportions and different degrees of development, arising from tooth-germs or from teeth still in process of growth (Bland Sutton).Odontomas resemble teeth in so far that during their development they remain hidden below the mucous membrane and give no evidence of their existence.There then succeeds, usually between the twentieth and twenty-fifth years, an eruptive stage, which is often attended with suppuration, and this may be the means of drawing attention to the tumour.Following Bland Sutton, several varieties of odontoma may be distinguished according to the part of the tooth-germ concerned in their formation.The  epithelial odontoma  is derived from persistent portions of the epithelium of the enamel organ, and constitutes a multilocular cystic tumour which is chiefly met with in the mandible.The cystic spaces of the tumour contain a brownish glairy fluid.Following Bland Sutton, several varieties of odontoma may be distinguished according to the part of the tooth-germ concerned in their formation.The  epithelial odontoma  is derived from persistent portions of the epithelium of the enamel organ, and constitutes a multilocular cystic tumour which is chiefly met with in the mandible.The cystic spaces of the tumour contain a brownish glairy fluid.These tumours have been described by Eve under the name of multilocular cystic epithelial tumours of the jaw.The  follicular odontoma , also known as a  dentigerous cyst , is derived from the distension of a tooth follicle.It constitutes a cyst containing a viscid fluid, and an imperfectly formed tooth is often found embedded in its wall.
describe: Fibromatosis|"Diffuse fibroma  or  Fibromatosis , analogous to lipomatosis, is met with in the connective tissue of the skin and sheaths of nerves, and constitutes one form of neuro-fibromatosis; a similar change is also met with in the stomach and colon.Myxoma.A myxoma is composed of tissue of a soft gelatinous, semifluid consistence.The pure myxoma is extremely rare, and clinically resembles the lipoma.Myxomatous tissue is, however, frequently found in other connective-tissue tumours as a result of degeneration, for example, in cartilaginous tumours and in sarcomas.Myxomatous tissue is also a prominent constituent of the ""innocent parotid tumour.""Diffuse or Generalised Neuro-Fibromatosis Recklinghausen's Disease.These terms are now used to include what were formerly known as ""multiple neuromata,"" as well as certain other overgrowths related to nerves.The essential lesion is an overgrowth of the endoneural connective tissue throughout the nerves of both the cerebro-spinal and sympathetic systems.The nerves are diffusely and unequally thickened, so that small twigs may become enlarged to the size of the median, while at irregular intervals along their course the connective-tissue overgrowth is exaggerated so as to form tumour-like swellings similar to the trunk-neuroma already described.The tumours, which vary greatly in size and number as many as a thousand have been counted in one case are enclosed in a capsule derived from the perineurium.The fibromatosis may also affect the cranial nerves, the ganglia on the posterior nerve roots, the nerves within the vertebral canal, and the sympathetic nerves and ganglia, as well as the continuations of the motor nerves within the muscles."
describe: semifluid consistence|"A myxoma is composed of tissue of a soft gelatinous, semifluid consistence.The pure myxoma is extremely rare, and clinically resembles the lipoma.Myxomatous tissue is, however, frequently found in other connective-tissue tumours as a result of degeneration, for example, in cartilaginous tumours and in sarcomas.Myxomatous tissue is also a prominent constituent of the ""innocent parotid tumour.""Mucous polypus of the nose, which is often described as a myxoma, is merely a pendulous process of œdematous mucous membrane.Myeloma."
