question|answer
describe: Sequela of Acute Suppurative Osteomyelitis|Sequela of Acute Suppurative Osteomyelitis.The commonest sequel is the presence of a sequestrum with one or more discharging sinuses; owing to the abundant formation of scar tissue these sinuses have rigid edges which are usually depressed and adherent to the bone.The Recognition and Removal of Sequestra.So long as there is dead bone there will be suppuration from the granulations lining the cavity in which it lies, and a discharge of pus from the sinuses, so that the mere persistence of discharge after an attack of osteomyelitis, is presumptive evidence of the occurrence of necrosis.Where there are one or more sinuses, the passage of a probe which strikes bare bone affords corroboration of the view that the bone has perished.When the dead bone has been separated from the living, the X-rays yield the most exact information.
describe: The Recognition and Removal of|The Recognition and Removal of Sequestra.So long as there is dead bone there will be suppuration from the granulations lining the cavity in which it lies, and a discharge of pus from the sinuses, so that the mere persistence of discharge after an attack of osteomyelitis, is presumptive evidence of the occurrence of necrosis.Where there are one or more sinuses, the passage of a probe which strikes bare bone affords corroboration of the view that the bone has perished.When the dead bone has been separated from the living, the X-rays yield the most exact information.The traditional practice is to wait until the dead bone is entirely separated before undertaking an operation for its removal, from fear, on the one hand, of leaving portions behind which may keep up the discharge, and, on the other, of removing more bone than is necessary.This practice need not be adhered to, as by operating at an earlier stage healing is greatly hastened.
describe: Circumscribed Abscess|"Clinical Features of an Acute Circumscribed Abscess.In the initial stages the usual symptoms of inflammation are present.Increased elevation of temperature, with or without a rigor, progressive leucocytosis, and sweating, mark the transition between inflammation and suppuration.An increasing leucocytosis is evidence that a suppurative process is spreading.The local symptoms vary with the seat of the abscess.When it is situated superficially for example, in the breast tissue the affected area is hot, the redness of inflammation gives place to a dusky purple colour, with a pale, sometimes yellow, spot where the pus is near the surface.Circumscribed Abscess of Bone ""Brodie's Abscess.""The most important form of relapsing osteomyelitis is the circumscribed abscess of bone first described by Benjamin Brodie.It is usually met with in young adults, but we have met with it in patients over fifty.Several years may intervene between the original attack of osteomyelitis and the onset of symptoms of abscess.Morbid Anatomy.The abscess is nearly always situated in the central axis of the bone in the region of the ossifying junction, although cases are occasionally met with in which it lies nearer the middle of the shaft."
describe: un-united fract|There still remain those forms of osteomyelitis which result from infection through a wound involving the bone for example, compound fractures, gun-shot injuries, osteotomies, amputations, resections, or operations for un-united fracture.In all of these the marrow is exposed to infection by such organisms as are present in the wound.A similar form of osteomyelitis may occur apart from a wound for example, infection may spread to the jaws from lesions of the mouth; to the skull, from lesions of the scalp or of the cranial bones themselves such as a syphilitic gumma or a sarcoma which has fungated externally; or to the petrous temporal, from suppuration in the middle ear.The most common is an osteomyelitis commencing in the marrow exposed in a wound infected with pyogenic organisms.In amputation stumps, fungating granulations protrude from the sawn end of the bone, and if necrosis takes place, the sequestrum is annular, affecting the cross-section of the bone at the saw-line; or tubular, extending up the shaft, and tapering off above.The periosteum is more easily detached, is thicker than normal, and is actively engaged in forming bone.
describe: the tubercle bacil|There is evidence that a  mixed infection  that is, the introduction of more than one species of organism, for example, the tubercle bacillus and a pyogenic staphylococcus increases the severity of the resulting disease.If one of the varieties gain the ascendancy, the poisons produced by the others so devitalise the tissue cells, and diminish their power of resistance, that the virulence of the most active organisms is increased.On the other hand, there is reason to believe that the products of certain organisms antagonise one another for example, an attack of erysipelas may effect the cure of a patch of tuberculous lupus.Lastly, in patients suffering from chronic wasting diseases, bacteria may invade the internal organs by the blood-stream in enormous numbers and with great rapidity, during the period of extreme debility which shortly precedes death.The discovery of such collections of organisms on post-mortem examination may lead to erroneous conclusions being drawn as to the cause of death.Results of Bacterial Growth.Others, on the contrary for example, the tubercle bacillus and the organism of acute osteomyelitis although frequently remaining localised at the seat of inoculation, tend to pass to distant parts, lodging in the capillaries of joints, bones, kidney, or lungs, and there producing their deleterious effects.In the human subject, multiplication in the blood-stream does not occur to any great extent.In some general acute pyogenic infections, such as osteomyelitis, cellulitis, etc., pure cultures of staphylococci or of streptococci may be obtained from the blood.In pneumococcal and typhoid infections, also, the organisms may be found in the blood.It is by the vital changes they bring about in the parts where they settle that micro-organisms disturb the health of the patient.In deriving nourishment from the complex organic compounds in which they nourish, the organisms evolve, probably by means of a ferment, certain chemical products of unknown composition, but probably colloidal in nature, and known as  toxins .
describe: dactylitis|"Gummatous disease is frequently observed also in the flat bones of the skull, in the bones of the hand, as syphilitic dactylitis, and in the bones of the forearm and leg.When the tibia is affected the disease is frequently bilateral, and may assume the form of gummatous ulcers and sinuses.In later years the tibia may present alterations in shape resulting from antecedent gummatous disease for example, nodular thickenings of the shaft, flattening of the crest, or a more uniform increase in thickness and length of the shaft of the bone, which, when it is curved in addition, is described as the ""sabre-blade"" deformity.Among lesions of the viscera, mention should be made of gumma of the testis, which causes the organ to become enlarged, uneven, and indurated.This has even been observed in infants a few months old.Occasionally a syphilitic child suffers from a succession of these gummatous lesions with resulting ill-health, and, it may be, waxy disease of the internal organs; on the other hand, it may recover and present no further manifestations of the inherited taint.When growing in the interior of a bone it causes a spindle-shaped enlargement of the shaft, which in the case of a phalanx or metacarpal bone may resemble the dactylitis resulting from tubercle or syphilis.A chondroma appears as a clear area in a skiagram.A  skiagram  of a bone in which there is a chondroma shows a clear rounded area in the position of the tumour, which must be differentiated from similar clear areas due to other kinds of tumour, especially the myeloma; when it has undergone calcification or ossification, it gives a shadow as dark as bone.Treatment.In view of the unstable quality of the chondroma, especially of its liability to become malignant, it should be removed as soon as it is recognised.In those projecting from the surface of a bone, both the tumour and its capsule should be removed."
describe: Evanescent|Evanescent periostitis  is met with in acquired syphilis during the period of the early skin eruptions.The patient complains, especially at night, of pains over the frontal bone, ribs, sternum, tibia, or ulna.Localised tenderness is elicited on pressure, and there is slight swelling, which, however, rarely amounts to what may be described as a  periosteal node .In the later stages of acquired syphilis,  gummatous periostitis and osteomyelitis  occur, and are characterised by the formation in the periosteum and marrow of circumscribed gummata or of a diffuse gummatous infiltration.The framework of the bone is rarefied in the area immediately involved, and sclerosed in the parts beyond.If the gummatous tissue degenerates and breaks down, and especially if the overlying skin is perforated and septic infection is superadded, the bone disintegrates and exhibits the condition known as  syphilitic caries ; sometimes a portion of bone has its blood supply so far interfered with that it dies  syphilitic necrosis .
describe: Jacksonian|On the inner surface of the skull, the formation of gummatous tissue may cause pressure on the brain and give rise to intense pain in the head, Jacksonian epilepsy, or paralysis, the symptoms varying with the seat and extent of the disease.The cranial nerves may be pressed upon at the base, especially at their points of exit, and this gives rise to symptoms of irritation or paralysis in the area of distribution of the nerves affected.In the septum of the nose, the nasal bones, and the hard palate , gummatous disease causes ulceration, which, beginning in the mucous membrane, spreads to the bones, and being complicated with septic infection leads to caries and necrosis.In the nose, the disease is attended with stinking discharge (ozœna), the extrusion of portions of dead bone, and subsequently with deformity characterised by loss of the bridge of the nose; in the palate, it is common to have a perforation, so that the air escapes through the nose in speaking, giving to the voice a characteristic nasal tone.Syphilitic disease of the tibia  may be taken as the type of the affection as it occurs  in the long bones .Gummatous disease in the periosteum may be localised and result in the formation of a well-defined node, or the whole shaft may become the seat of an irregular nodular enlargement (Fig.
describe: Craniotabes|Craniotabes is recovered from as the child improves in health.Between the ages of three and six months, certain other phenomena may be met with, such as  effusion into the joints , especially the knees;  iritis , in one or in both eyes, and enlargement of the spleen and liver.In the majority of cases the child recovers from these early manifestations, especially when efficiently treated, and may enjoy an indefinite period of good health.On the other hand, when it attains the age of from two to four years, it may begin to manifest lesions which correspond to those of the tertiary period of acquired syphilis.Later Lesions.In the skin and subcutaneous tissue, the later manifestations may take the form of localised gummata, which tend to break down and form ulcers, on the leg for example, or of a spreading gummatous infiltration which is also liable to ulcerate, leaving disfiguring scars, especially on the face.Craniotabes , in which the flat bones of the skull undergo absorption in patches, was formerly regarded as syphilitic, but it is now known to result from prolonged malnutrition from any cause.Bossing of the skull  resulting in the formation of Parrot's nodes is also being withdrawn from the category of syphilitic affections.The lesions in infancy epiphysitis, bossing of the skull, and craniotabes have been referred to in the chapter on inherited syphilis.Epiphysitis or Syphilitic Perichondritis.The first of these terms is misleading, because the lesion involves the ossifying junction and the shaft of the bone, and the epiphysis only indirectly.The young bone is replaced by granulation tissue, so that large clear areas are seen with the X-rays.
describe: craniotabes|"The conditions of the skull known as Parrot's nodes or bosses, and craniotabes, were formerly believed to be characteristic of inherited syphilis, but they are now known to occur, particularly in rickety children, from other causes.The  bosses  result from the heaping up of new spongy bone beneath the pericranium, and they may be grouped symmetrically around the anterior fontanelle, or may extend along either side of the sagittal suture, which appears as a deep groove the ""natiform skull.""The bosses disappear in time, but the skull may remain permanently altered in shape, the frontal and parietal eminences appearing unduly prominent.The term  craniotabes  is applied when the bone becomes thin and soft, reverting to its original membranous condition, so that the affected areas dimple under the finger like parchment or thin cardboard; its localisation in the posterior parts of the skull suggests that the disappearance of the osseous tissue is influenced by the pressure of the head on the pillow.Craniotabes is recovered from as the child improves in health.Between the ages of three and six months, certain other phenomena may be met with, such as  effusion into the joints , especially the knees;  iritis , in one or in both eyes, and enlargement of the spleen and liver.The term  craniotabes  is applied when the bone becomes thin and soft, reverting to its original membranous condition, so that the affected areas dimple under the finger like parchment or thin cardboard; its localisation in the posterior parts of the skull suggests that the disappearance of the osseous tissue is influenced by the pressure of the head on the pillow.Craniotabes is recovered from as the child improves in health.Between the ages of three and six months, certain other phenomena may be met with, such as  effusion into the joints , especially the knees;  iritis , in one or in both eyes, and enlargement of the spleen and liver.In the majority of cases the child recovers from these early manifestations, especially when efficiently treated, and may enjoy an indefinite period of good health.On the other hand, when it attains the age of from two to four years, it may begin to manifest lesions which correspond to those of the tertiary period of acquired syphilis.Later Lesions."
describe: fragilitas|CONSTITUTIONAL DISEASES ATTENDED WITH LESIONS IN THE BONES These include rickets, scurvy-rickets, osteomalacia, ostitis deformans, osteomyelitis fibrosa, fragilitas ossium, and diseases of the nervous system.RICKETS Rickets or rachitis is a constitutional disease associated with disturbance of nutrition, and attended with changes in the skeleton.The disease is most common and most severe among the children of the poorer classes in large cities, who are improperly fed and are brought up in unhealthy surroundings.There is evidence that the most important factors in the causation of rickets are ill-health of the mother during pregnancy, and the administration to the child after its birth of food which is defective in animal fat, proteids, and salts of lime, or which contains these in such a form that they are not readily assimilated.The occurrence of the disease is favoured, and its features are aggravated, by imperfect oxygenation of the blood as the result of a deficiency of fresh air and sunlight, want of exercise, and by other conditions which prevail in the slums of large towns.Pathological Anatomy.
describe: Rachitis Adolescentium  |Late Rickets  or  Rachitis Adolescentium  is met with at any age from nine to seventeen, and is generally believed to be due to a recrudescence of rickets which had been present in childhood.The disease is not attended with any disturbance of the general health; the pathological changes are the same as in infantile rickets, but are for the most part confined to the ossifying junctions, especially those which are most active during adolescence, for example at the knee-joint.The patient is easily tired, complains of pain in the bones, and, unless care is taken, deformity is liable to ensue.There can be no doubt that adolescent rickets plays an important part in the production of the deformities which occur at or near puberty, especially knock-knee and bow-knee.Scurvy-Rickets  or  Infantile Scurvy .This disease, described by Barlow and Cheadle, is met with in infants under two years who have been brought up upon sterilised or condensed milk and other proprietary foods, and is most common in the well-to-do classes.
describe: Hamorrhages|Hamorrhages also occur into the skin, presenting the appearance of bruises, into the orbit and conjunctiva, and from the mucous membranes.The  treatment  consists in correcting the errors in diet.The infant should have a wet nurse or a plentiful supply of cow's milk in its natural state.Anti-scorbutics in the form of orange, lemon, or grape juice, and of potatoes bruised down in milk, may be given.Osteomalacia.The term osteomalacia includes a group of conditions, closely allied to rickets, in which the bones of adults become soft and yielding, so that they are unduly liable to bend or break.
describe: conjunctiva|Grafts of  mucous membrane  are used to cover defects in the lip, cheek, and conjunctiva.The technique is similar to that employed in skin-grafting; the sources of mucous membrane are limited and the element of septic infection cannot always be excluded.Fat.Adipose tissue has a low vitality, but it is easily retained and it readily lends itself to transplantation.Portions of fat are often obtainable at operations from the omentum, for example, otherwise the subcutaneous fat of the buttock is the most accessible; it may be employed to fill up cavities of all kinds in order to obtain more rapid and sounder healing and also to remedy deformity, as in filling up a depression in the cheek or forehead.It is ultimately converted into ordinary connective tissue  pari passu  with the absorption of the fat.The conjunctiva also may be yellow.In the latter stages of the disease the pulse becomes small and fluttering; the tongue becomes dry and brown; sordes collect on the teeth; and a low muttering form of delirium supervenes.Secondary infection of the parotid gland frequently occurs, and gives rise to a suppurative parotitis.This condition is associated with severe pain, gradually extending from behind the angle of the jaw on to the face.There is also swelling over the gland, and eventually suppuration and sloughing of the gland tissue and overlying skin.Secondary abscesses in the lymph glands, subcutaneous tissue, or joints are often so insidious and painless in their development that they are only discovered accidentally.
describe: New Growths|New Growths in the Skin and Subcutaneous Tissue.The  Angioma  has been described with diseases of blood vessels.Fibroma.Various types of fibroma occur in the skin.A soft pedunculated fibroma, about the size of a pea, is commonly met with, especially on the neck and trunk; it is usually solitary, and is easily removed with scissors.The multiple, soft fibroma known as  molluscum fibrosum , which depends upon a neuro-fibromatosis of the cutaneous nerves, is described with the tumours of nerves.Osteomalacia associated with New Growths in the Skeleton.When  secondary cancer  is widely distributed throughout the skeleton, it is associated with softening of the bones, as a result of which they readily bend or break, and after death are easily cut with a knife.In the disease known as  multiple myeloma , the interior of the ribs, sternum, and bodies of the vertebra is occupied by a reddish gelatinous pulp, the structure of which resembles sarcoma; the bones are reduced to a mere shell, and may break on the slightest pressure; the urine contains albumose, a substance resembling albumen but coagulating at a comparatively low temperature (140° F.), and the coagulum is re-dissolved on boiling, and it is readily precipitated by hydrochloric acid (Bence-Jones).Ostitis Deformans Paget's Disease of Bone.This rare disease was first described by Sir James Paget in 1877.In the early stages, the marrow is transformed into a vascular connective tissue; its bone-eating functions are exaggerated, and the framework of the bone becomes rarefied, so that it bends under pressure as in osteomalacia.
describe: Ostitis Deformans Paget's Disease of Bone|Ostitis Deformans Paget's Disease of Bone.This rare disease was first described by Sir James Paget in 1877.In the early stages, the marrow is transformed into a vascular connective tissue; its bone-eating functions are exaggerated, and the framework of the bone becomes rarefied, so that it bends under pressure as in osteomalacia.In course of time, however, new bone is formed in great abundance; it is at first devoid of lime salts, but later becomes calcified, so that the bones regain their rigidity.This formation of new bone is much in excess of the normal, the bones become large and bulky, their surfaces rough and uneven, their texture sclerosed in parts, and the medullary canal is frequently obliterated.These changes are well brought out in X-ray photographs.
describe: Fragilitas Ossium|Osteogenesis Imperfecta ,  Fragilitas Ossium , or  Congenital Osteopsathyrosis .These terms are used to describe a condition in which an undue fragility of the bones dates from intra-uterine life.It may occur in several members of the same family.In severe cases, intra-uterine fractures occur, and during parturition fresh fractures are almost sure to be produced, so that at birth there is a combination of recent fractures and old fractures united and partly united, with bendings and thickenings of the bones.Large areas of the cranial vault may remain membranous.After birth the predisposition to fracture continues, the bones are easily broken, the fractures are attended with little or no pain, the crepitus is soft, and although union may take place, it may be delayed and be attended with excess of callus.
describe: Periosteal|"Periosteal tuberculosis  is met with in the ribs, sternum, vertebral column, skull, and less frequently in the long bones of the limbs.It may originate in the periosteum, or may spread thence from the marrow, or from synovial membrane.In superficial bones , such as the sternum, the formation of tuberculous granulation tissue in the deeper layer of the periosteum, and its subsequent caseation and liquefaction, is attended by the insidious development of a doughy swelling, which is not as a rule painful, although tender on pressure.While the swelling often remains quiescent for some time, it tends to increase in size, to become boggy or fluctuating, and to assume the characters of a cold abscess.The pus perforates the fibrous layer of the periosteum, invading and infecting the overlying soft parts, its spread being influenced by the anatomical arrangement of the tissues.The size of the abscess affords no indication of the extent of the bone lesion from which it originates.Periosteal tumours  are at first situated on one side of the bone, but as they grow they tend to surround it completely.Innocent periosteal tumours retain the outer fibrous layer as a capsule.Malignant tumours tend to perforate the periosteal capsule and invade the soft parts.Central  or  medullary tumours  as they increase in size replace the surrounding bone, and simultaneously new bone is formed on the surface; as this is in its turn absorbed, further bone is formed beneath the periosteum, so that in time the bone is increased in girth, and is said to be ""expanded"" by the growth in its interior.Primary Tumours Osteoma.When the tumour projects from the surface of a bone it is called an  exostosis ."
describe: Multiple Exostoses|Multiple Exostoses.This disease, which, by custom, is still placed in the category of tumours, is to be regarded as a disorder of growth, dating from intra-uterine life and probably due to a disturbance in the function of the glands of internal secretion, the thyreoid being the one which is most likely to be at fault (Arthur Keith).The disorder of growth is confined to those elements of the skeleton where a core of bone formed in cartilage comes to be encased in a sheath of bone formed beneath the periosteum.To indicate this abnormality the name  diaphysial aclasis  has been employed by Arthur Keith at the suggestion of Morley Roberts.Bones formed entirely in cartilage are exempt, namely, the tarsal and carpal bones, the epiphyses of the long bones, the sternum, and the bodies of the vertebra.Bones formed entirely in membrane, that is, those of the face and of the cranial vault, are also exempt.
