question|answer
describe: Hamorrhage|"Hamorrhage  from erosion of arterial or venous trunks may take place and endanger life.Treatment.The treatment of diffuse cellulitis depends to a large extent on the situation and extent of the affected area, and on the stage of the process.In the limbs , for example, where the application of a constricting band is practicable, Bier's method of inducing passive hyperamia yields excellent results.If pus is formed, one or more small incisions are made and a light moist dressing placed over the wounds to absorb the discharge, but no drain is inserted.The whole of the inflamed area should be covered with gauze wrung out of a 1 in 10 solution of ichthyol in glycerine.Hamorrhage is easily controlled by digital pressure, and the use of a tourniquet should be dispensed with, as the constriction of the limb is liable to interfere with the vitality of the flaps.When the tibial vessels can be felt pulsating at the ankle it may be justifiable, if the patient urgently desires it, to amputate lower than the knee; but there is considerable risk of gangrene recurring in the stump and necessitating a second operation.That amputation for senile gangrene performed between the ankle and the knee seldom succeeds, is explained by the fact that the vascular obstruction is usually in the upper part of the posterior tibial artery, and the operation is therefore performed through tissues with an inadequate blood supply.It is not uncommon, indeed, on amputating above the knee, to find even the popliteal artery plugged by a clot.This should be removed at the amputation by squeezing the vessel from above downward by a ""milking"" movement, or by ""catheterising the artery"" with the aid of a cannula with a terminal aperture.It is to be borne in mind that the object of amputation in these cases is merely to remove the gangrenous part, and so relieve the patient of the discomfort and the risks from infection which its presence involves."
describe: The cutaneous navus|"The cutaneous navus , ""mother's mark,"" or ""port-wine stain,"" consists of an aggregation of dilated capillaries in the substance of the skin.On stretching the skin the vessels can be seen to form a fine network, or to run in leashes parallel to one another.A dilated arteriole or a vein winding about among the capillaries may sometimes be detected.These navi occur on any part of the body, but they are most frequently met with on the face.They may be multiple, and vary greatly in size, some being no bigger than a pin-head, while others cover large areas of the body.In colour they present every tint from purple to brilliant red; in the majority there is a considerable dash of blue, especially in cold weather."
describe: Mixed Navus|Mixed Navus.As its name indicates, the mixed navus partakes of the characters of the other two varieties; that is, it is a subcutaneous navus with involvement of the skin.It is frequently met with on the face and head, but may occur on any part of the body.It also affects parts covered by mucous membrane, such as the cheek, tongue, and soft palate.The swelling is rounded or lobulated, and projects beyond the level of its surroundings.Sometimes the skin is invaded by the navoid tissue over the whole extent of the tumour, sometimes only over a limited area.
describe: the mixed navus|As its name indicates, the mixed navus partakes of the characters of the other two varieties; that is, it is a subcutaneous navus with involvement of the skin.It is frequently met with on the face and head, but may occur on any part of the body.It also affects parts covered by mucous membrane, such as the cheek, tongue, and soft palate.The swelling is rounded or lobulated, and projects beyond the level of its surroundings.Sometimes the skin is invaded by the navoid tissue over the whole extent of the tumour, sometimes only over a limited area.Frequently the margin only is of a bright-red colour, while the skin in the centre resembles a cicatrix.
describe: narrowings|The affected vessels slowly increase in size, and become tortuous, with narrowings and dilatations here and there.Grooves and gutters are frequently found in the bone underlying the dilated vessels.There is a constant loud bruit in the tumour, which greatly troubles the patient and may interfere with sleep.There is no tendency either to natural cure or to rupture, but severe and even fatal hamorrhage may follow a wound of the dilated vessels.The condition may be treated by excision or by electrolysis.In excision the hamorrhage is controlled by an elastic tourniquet applied horizontally round the head, or by ligation of the feeding trunks.
describe: Extirpation|Extirpation of the Sac The Old Operation.The procedure which goes by this name consists in exposing the aneurysm, incising the sac, clearing out the clots, and ligating the artery above and below the sac.This method is suitable to sacculated aneurysm of the limbs, so long as they are circumscribed and free from complications.It has been successfully practised also in aneurysm of the subclavian, carotid, and external iliac arteries.It is not applicable to cases in which there is such a degree of atheroma as would interfere with the successful ligation of the artery.The continuity of the artery may be restored by grafting into the gap left after excision of the sac a segment of the great saphena vein.Extirpation of the sac is probably the best method of treatment, especially in those of traumatic origin.These operations are attended with considerable risk of hemiplegia from interference with the blood supply of the brain.The  external carotid  and the cervical portion of the  internal carotid  are seldom the primary seat of aneurysm, although they are liable to be implicated by the upward spread of an aneurysm at the bifurcation of the common trunk.In addition to the ordinary signs of aneurysm, the clinical manifestations are chiefly referable to pressure on the pharynx and larynx, and on the hypoglossal nerve.Aneurysm of the internal carotid is of special importance on account of the way in which it bulges into the pharynx in the region of the tonsil, in some cases closely simulating a tonsillar abscess.Cases are on record in which such an aneurysm has been mistaken for an abscess and incised, with disastrous results.
describe: the Sac The Old Operation|Extirpation of the Sac The Old Operation.The procedure which goes by this name consists in exposing the aneurysm, incising the sac, clearing out the clots, and ligating the artery above and below the sac.This method is suitable to sacculated aneurysm of the limbs, so long as they are circumscribed and free from complications.It has been successfully practised also in aneurysm of the subclavian, carotid, and external iliac arteries.It is not applicable to cases in which there is such a degree of atheroma as would interfere with the successful ligation of the artery.The continuity of the artery may be restored by grafting into the gap left after excision of the sac a segment of the great saphena vein.
describe: Distal Ligation|"Distal Ligation.The tying of the artery beyond the sac, or of its two branches where it bifurcates (Brasdor, 1760, and Wardrop, 1825), may arrest or only diminish the flow of blood through the sac.It is less successful than the proximal ligature, and is therefore restricted to aneurysms so situated as not to be amenable to other methods; for example, in aneurysm of the common carotid near its origin, the artery may be ligated near its bifurcation, or in aneurysm of the innominate artery, the carotid and subclavian arteries are tied at the seat of election.Compression.Digital compression of the feeding artery has been given up except as a preparation for operations on the sac with a view to favouring the development of a collateral circulation.Macewen's acupuncture or ""needling""  consists in passing one or more fine, highly tempered steel needles through the tissues overlying the aneurysm, and through its outer wall."
describe: white gelatin|solution of white gelatin in normal salt solution being injected at a temperature of about 100° F.; the injection of pituitary extract.The application of a pad of gauze soaked in the blood of a normal person sometimes arrests the bleeding.To prevent bleeding in hamophilics, intra-venous or subcutaneous injections of fresh blood serum, taken from the human subject, the sheep, the dog, or the horse, have proved useful.If fresh serum is not available, anti-diphtheritic or anti-tetanic serum or trade preparations, such as hemoplastin, may be employed.We have removed the appendix and amputated through the thigh in hamophilic subjects without excessive loss of blood after a course of fresh sheep's serum given by the mouth over a period of several weeks.The chloride and lactate of calcium, and extract of thymus gland have been employed to increase the coagulability of the blood.solution of white gelatin in sterilised water, at a temperature of about 100° F., are injected into the subcutaneous tissue of the abdomen every two, three, or four days.In the course of a fortnight or three weeks improvement may begin.The clot which forms is liable to soften and be absorbed, but a repetition of the injection has in several cases established a permanent cure.Amputation of the limb  is indicated in cases complicated by suppuration, by secondary hamorrhage after excision or ligation, or by gangrene.Amputation at the shoulder was performed by Fergusson in a case of subclavian aneurysm, as a means of arresting the blood-flow through the sac.TRAUMATIC ANEURYSM The essential feature of a traumatic aneurysm is that it is produced by some form of injury which divides all the coats of the artery.
describe: Innominate|Innominate aneurysm  may be of the fusiform or of the sacculated variety, and is frequently associated with pouching of the aorta.It usually grows upwards and laterally, projecting above the sternum and right clavicle, which may be eroded or displaced (Fig.75).Symptoms of pressure on the structures in the neck, similar to those produced by aortic aneurysm, occur.The pulses in the right upper extremity and in the right carotid and its branches are diminished and delayed.Pressure on the right brachial plexus causes shooting pain down the arm and muscular paresis on that side.
describe: Orbital Aneurysm|Orbital Aneurysm.The term pulsating exophthalmos is employed to embrace a number of pathological conditions, including aneurysm, in which the chief symptoms are pulsation in the orbit and protrusion of the eyeball.There may be, in addition, congestion and œdema of the eyelids, and a distinct thrill and murmur, which can be controlled by compression of the common carotid in the neck.Varying degrees of ocular paralysis and of interference with vision may also be present.These symptoms are due, in the majority of cases, to an aneurysmal varix of the internal carotid artery and cavernous sinus, which is often traumatic in origin, being produced either by fracture of the base of the skull or by a punctured wound of the orbit.In other cases they are due to aneurysm of the ophthalmic artery, to thrombosis of the cavernous sinus, and, in rare instances, to cirsoid aneurysm.
describe: exophthalmos|The term pulsating exophthalmos is employed to embrace a number of pathological conditions, including aneurysm, in which the chief symptoms are pulsation in the orbit and protrusion of the eyeball.There may be, in addition, congestion and œdema of the eyelids, and a distinct thrill and murmur, which can be controlled by compression of the common carotid in the neck.Varying degrees of ocular paralysis and of interference with vision may also be present.These symptoms are due, in the majority of cases, to an aneurysmal varix of the internal carotid artery and cavernous sinus, which is often traumatic in origin, being produced either by fracture of the base of the skull or by a punctured wound of the orbit.In other cases they are due to aneurysm of the ophthalmic artery, to thrombosis of the cavernous sinus, and, in rare instances, to cirsoid aneurysm.If compression of the common carotid is found to arrest the pulsation, ligation of this vessel is indicated.
describe: Femoral Arteries|Inguinal Aneurysm  ( Aneurysm of the Iliac and Femoral Arteries ).Aneurysms appearing in the region of Poupart's ligament may have their origin in the external or common iliac arteries or in the upper part of the femoral.On account of the tension of the fascia lata, they tend to spread upwards towards the abdomen, and, to a less extent, downwards into the thigh.Sometimes a constriction occurs across the sac at the level of Poupart's ligament.The pressure exerted on the nerves and veins of the lower extremity causes pain, congestion, and œdema of the limb.Rupture may take place externally, or into the cellular tissue of the iliac fossa.
describe: Surgical Anatomy and Physiology|Surgical Anatomy and Physiology.Lymph is essentially blood plasma, which has passed through the walls of capillaries.After bathing and nourishing the tissues, it is collected by lymph vessels, which return it to the blood stream by way of the thoracic duct.These lymph vessels take origin in the lymph spaces of the tissues and in the walls of serous cavities, and they usually run alongside blood vessels  perivascular lymph vessels .They have a structure similar to that of veins, but are more abundantly provided with valves.Along the course of the lymph trunks are the  lymph glands , which possess a definite capsule and are composed of a reticulated connective tissue, the spaces of which are packed with leucocytes.
describe: glandula concatinata|The sterno-mastoid glands  glandula concatinata form a chain along the posterior edge of the sterno-mastoid muscle, some of them lying beneath the muscle.They are commonly enlarged in secondary syphilis.The superior deep cervical (internal jugular) glands  from six to twenty in number form a continuous chain along the internal jugular vein, beneath the sterno-mastoid muscle.They drain the various groups of glands which lie nearer the surface, also the interior of the skull, the larynx, trachea, thyreoid, and lower part of the pharynx, and pour their lymph into the main trunks at the root of the neck.Belonging to this group is one large gland (the tonsillar gland) which lies behind the posterior belly of the digastric, and rests in the angle between the internal jugular and common facial veins.It is commonly enlarged in affections of the tonsil and posterior part of the tongue.
describe: anticus major muscle|The retro-pharyngeal glands  lie on each side of the median line upon the rectus capitis anticus major muscle and in front of the pre-vertebral layer of the cervical fascia.They receive part of the lymph from the posterior wall of the pharynx, the interior of the nose and its accessory cavities, the auditory (Eustachian) tube, and the tympanum.When they are infected with pyogenic organisms or with tubercle bacilli, they may lead to the formation of one form of retro-pharyngeal abscess.Upper Extremity.The epi-trochlear and cubital glands  vary in number, that most commonly present lying about an inch and a half above the medial epi-condyle, and other and smaller glands may lie along the medial (internal) bicipital groove or at the bend of the elbow.They drain the ulnar side of the hand and forearm, and pour their lymph into the axillary group.
describe: chyle  chylorrhœa|The injury may, however, not be observed at the time of operation, but later through the dressings being soaked with chyle  chylorrhœa .If the wound involves the only existing main duct and all the chyle escapes, the patient suffers from intense thirst, emaciation, and weakness, and may die of inanition; but if, as is usually the case, only one of several collateral channels is implicated, the loss of chyle may be of little moment, as the discharge usually ceases.If the wound heals so that the chyle is prevented from escaping, a fluctuating swelling may form beneath the scar; in course of time it gradually disappears.An attempt should be made to close the wound in the duct by means of a fine suture; failing this, the duct must be occluded by a ligature as if it were a bleeding artery.The tissues are then stitched over it and the skin wound accurately closed, so as to obtain primary union, firm pressure being applied by dressings and an elastic webbing bandage.Even if the main duct is obliterated, a collateral circulation is usually established.
describe: Lymphangiectasis|Lymphangiectasis  is a dilated or varicose condition of lymph vessels.It is met with as a congenital affection in the tongue and lips, or it may be acquired as the result of any condition which is attended with extensive obliteration or blocking of the main lymph trunks.An interesting type of lymphangiectasis is that which results from the presence of the  filaria Bancrofti  in the vessels, and is observed chiefly in the groin, spermatic cord, and scrotum of persons who have lived in the tropics.Filarial disease in the lymphatics of the groin  appears as a soft, doughy swelling, varying in size from a walnut to a cocoa-nut; it may partly disappear on pressure and when the patient lies down.The patient gives a history of feverish attacks of the nature of lymphangitis during which the swelling becomes painful and tender.These attacks may show a remarkable periodicity, and each may be followed by an increase in the size of the swelling, which may extend along the inguinal canal into the abdomen, or down the spermatic cord into the scrotum.
describe: lymphangiectasis|Apart from injury, lymph cysts are met with as the result of the distension of lymph spaces and vessels ( lymphangiectasis ); and in lymphangiomas, of which the best-known example is the cystic hygroma or hydrocele of the neck.GANGLION This term is applied to a cyst filled with a clear colourless jelly or colloid material, met with in the vicinity of a joint or tendon sheath.The commonest variety the  carpal ganglion  popularly known as a sprained sinew is met with as a smooth, rounded, or oval swelling on the dorsal aspect of the carpus, usually towards its radial side (Fig.60).It is situated over one of the intercarpal or other joints in this region, and may be connected with one or other of the extensor tendons.The skin and fascia are movable over the cyst.An interesting type of lymphangiectasis is that which results from the presence of the  filaria Bancrofti  in the vessels, and is observed chiefly in the groin, spermatic cord, and scrotum of persons who have lived in the tropics.Filarial disease in the lymphatics of the groin  appears as a soft, doughy swelling, varying in size from a walnut to a cocoa-nut; it may partly disappear on pressure and when the patient lies down.The patient gives a history of feverish attacks of the nature of lymphangitis during which the swelling becomes painful and tender.These attacks may show a remarkable periodicity, and each may be followed by an increase in the size of the swelling, which may extend along the inguinal canal into the abdomen, or down the spermatic cord into the scrotum.On dissection, the swelling is found to be made up of dilated, tortuous, and thickened lymph vessels in which the parent worm is sometimes found, and of greatly enlarged lymph glands which have undergone fibrosis, with giant-cell formation and eosinophile aggregations.The fluid in the dilated vessels is either clear or turbid, in the latter case resembling chyle.
describe: Lymphangioma|Lymphangioma.A lymphangioma is a swelling composed of a series of cavities and channels filled with lymph and freely communicating with one another.The cavities result either from the new formation of lymph spaces or vessels, or from the dilatation of those which already exist; their walls are composed of fibro-areolar tissue lined by endothelium and strengthened by non-striped muscle.They are rarely provided with a definite capsule, and frequently send prolongations of their substance between and into muscles and other structures in their vicinity.They are of congenital origin and usually make their appearance at or shortly after birth.When the tumour is made up of a meshwork of caverns and channels, it is called a  cavernous lymphangioma ; when it is composed of one or more cysts, it is called a  cystic lymphangioma .Lymphangiomas are met with in the abdomen in the form of  omental cysts .DISEASES OF LYMPH GLANDS  Lymphadenitis.Inflammation of lymph glands results from the advent of an irritant, usually bacterial or toxic, brought to the glands by the afferent lymph vessels.These vessels may share in the inflammation and be the seat of lymphangitis, or they may show no evidence of the passage of the noxa.It is exceptional for the irritant to reach the gland through the blood-stream.A strain or other form of trauma is sometimes blamed for the onset of lymphadenitis, especially in the glands of the groin (bubo), but it is usually possible to discover some source of pyogenic infection which is responsible for the mischief, or to obtain a history of some antecedent infection such as gonorrhœa.
describe: lymphangio|The  periosteal lipoma  is usually congenital, and is most often met with in the hand; it forms a projecting lobulated tumour, which, when situated in the palm, resembles an angioma or a lymphangioma.The  subserous lipoma  arises from the extra-peritoneal fat in the posterior abdominal wall, in which case it tends to grow forwards between the layers of the mesentery and to give rise to an abdominal tumour; or it may grow from the extra-peritoneal fat in the anterior abdominal wall and protrude from one of the hernial openings or through an abnormal opening in the parietes, constituting a  fatty hernia .A  subsynovial lipoma  grows from the fat surrounding the synovial membrane of a joint, and projects into its interior, giving rise to the symptoms of loose body.Lipomas are also met with growing from the adipose connective tissue  between or in the substance of muscles , and, when situated beneath the deep fascia, such as the fascia lata of the thigh, the characteristic signs are obscured and a differential diagnosis is difficult.It may be differentiated from a cold abscess by puncture with an exploring needle.Zanthoma  is a rare but interesting form of tumour, composed of a fibrous and fatty tissue, containing a granular orange-yellow pigment, resembling that of the corpus luteum.Angioma ,  lymphangioma , and  neuroma  are described with the disease of the individual tissues.MALIGNANT CONNECTIVE-TISSUE TUMOURS SARCOMA The term sarcoma is applied to any connective-tissue tumour which exhibits malignant characters.The essential structural feature is the predominance of the cellular elements over the intercellular substance or stroma, in which respect a sarcoma resembles the connective tissue of the embryo.The typical sarcoma consists chiefly of immature or embryonic connective tissue.It most frequently originates from fascia, intermuscular connective tissue, periosteum, bone-marrow, and skin, and forms a rounded or nodulated tumour which appears to be encapsulated, but the capsule merely consists of the condensed surrounding tissues, and usually contains sarcomatous elements.The consistence of the tumour depends on the nature and amount of the stroma, and on the presence of degenerative changes.
describe: Lymphangiomas|Lymphangiomas are met with in the abdomen in the form of  omental cysts .DISEASES OF LYMPH GLANDS  Lymphadenitis.Inflammation of lymph glands results from the advent of an irritant, usually bacterial or toxic, brought to the glands by the afferent lymph vessels.These vessels may share in the inflammation and be the seat of lymphangitis, or they may show no evidence of the passage of the noxa.It is exceptional for the irritant to reach the gland through the blood-stream.A strain or other form of trauma is sometimes blamed for the onset of lymphadenitis, especially in the glands of the groin (bubo), but it is usually possible to discover some source of pyogenic infection which is responsible for the mischief, or to obtain a history of some antecedent infection such as gonorrhœa.
describe: Lymphadenitis|DISEASES OF LYMPH GLANDS  Lymphadenitis.Inflammation of lymph glands results from the advent of an irritant, usually bacterial or toxic, brought to the glands by the afferent lymph vessels.These vessels may share in the inflammation and be the seat of lymphangitis, or they may show no evidence of the passage of the noxa.It is exceptional for the irritant to reach the gland through the blood-stream.A strain or other form of trauma is sometimes blamed for the onset of lymphadenitis, especially in the glands of the groin (bubo), but it is usually possible to discover some source of pyogenic infection which is responsible for the mischief, or to obtain a history of some antecedent infection such as gonorrhœa.It is possible for gonococci to lie latent in the inguinal glands for long periods, and only give rise to lymphadenitis if the glands be subsequently subjected to injury.
describe: Tuberculous Disease of Glands|Tuberculous Disease of Glands.This is a disease of great frequency and importance.The tubercle bacilli usually gain access to the gland through the afferent lymph vessels, which convey them from some lesion of the surface within the area drained by them.Tuberculous infection may supervene in glands that are already enlarged as a result of chronic septic irritation.While any of the glands in the body may be affected, the disease is most often met with in the cervical groups which derive their lymph from the mouth, nose, throat, and ear.The appearance of the glands on section  varies with the stage of the disease.
