question|answer
describe: Healing by Primary Union|"Healing by Primary Union.The most favourable conditions for the progress of the reparative process are to be found in a clean-cut wound of the integument, which is uncomplicated by loss of tissue, by the presence of foreign substances, or by infection with disease-producing micro-organisms, and its edges are in contact.Such a wound in virtue of the absence of infection is said to be  aseptic , and under these conditions healing takes place by what is called ""primary union"" the ""healing by first intention"" of the older writers.Granulation Tissue.The essential and invariable medium of repair in all structures is an elementary form of new tissue known as  granulation tissue , which is produced in the damaged area in response to the irritation caused by injury or disease.The vital reaction induced by such irritation results in dilatation of the vessels of the part, emigration of leucocytes, transudation of lymph, and certain proliferative changes in the fixed tissue cells."
describe: Formation of Granulation Tissue|Formation of Granulation Tissue.When a wound is made in the integument under aseptic conditions, the passage of the knife through the tissues is immediately followed by an oozing of blood, which soon coagulates on the cut surfaces.In each of the divided vessels a clot forms, and extends as far as the nearest collateral branch; and on the surface of the wound there is a microscopic layer of bruised and devitalised tissue.If the wound is closed, the narrow space between its edges is occupied by blood-clot, which consists of red and white corpuscles mixed with a quantity of fibrin, and this forms a temporary uniting medium between the divided surfaces.During the first twelve hours, the minute vessels in the vicinity of the wound dilate, and from them lymph exudes and leucocytes migrate into the tissues.In from twenty-four to thirty-six hours, the capillaries of the part adjacent to the wound begin to throw out minute buds and fine processes, which bridge the gap and form a firmer, but still temporary, connection between the two sides.
describe: Formation of Cicatricial Tissue|Formation of Cicatricial Tissue.The transformation of this temporary granulation tissue into scar tissue is effected by the fibroblasts, which become elongated and spindle-shaped, and produce in and around them a fine fibrillated material which gradually increases in quantity till it replaces the cell protoplasm.In this way white fibrous tissue is formed, the cells of which are arranged in parallel lines and eventually become grouped in bundles, constituting fully formed white fibrous tissue.In its growth it gradually obliterates the capillaries, until at the end of two, three, or four weeks both vessels and cells have almost entirely disappeared, and the original wound is occupied by cicatricial tissue.In course of time this tissue becomes consolidated, and the cicatrix undergoes a certain amount of contraction  cicatricial contraction .Healing of Epidermis.
describe: Healing of Epidermis|Healing of Epidermis.While these changes are taking place in the deeper parts of the wound, the surface is being covered over by  epidermis  growing in from the margins.Within twelve hours the cells of the rete Malpighii close to the cut edge begin to sprout on to the surface of the wound, and by their proliferation gradually cover the granulations with a thin pink pellicle.As the epithelium increases in thickness it assumes a bluish hue and eventually the cells become cornified and the epithelium assumes a greyish-white colour.Clinical Aspects.So long as the process of repair is not complicated by infection with micro-organisms, there is no interference with the general health of the patient.
describe: Healing by Union|Healing by Union of two Granulating Surfaces.In gaping wounds union is sometimes obtained by bringing the two surfaces into apposition after each has become covered with healthy granulations.The exudate on the surfaces causes them to adhere, capillary loops pass from one to the other, and their final fusion takes place by the further development of granulation and cicatricial tissue.Reunion of Parts entirely Separated from the Body.Small portions of tissue, such as the end of a finger, the tip of the nose or a portion of the external ear, accidentally separated from the body, if accurately replaced and fixed in position, occasionally adhere by primary union.In the course of operations also, portions of skin, fascia, or bone, or even a complete joint may be transplanted, and unite by primary union.
describe: Reunion of Parts|Reunion of Parts entirely Separated from the Body.Small portions of tissue, such as the end of a finger, the tip of the nose or a portion of the external ear, accidentally separated from the body, if accurately replaced and fixed in position, occasionally adhere by primary union.In the course of operations also, portions of skin, fascia, or bone, or even a complete joint may be transplanted, and unite by primary union.Healing under a Scab.When a small superficial wound is exposed to the air, the blood and serum exuded on its surface may dry and form a hard crust or  scab , which serves to protect the surface from external irritation in the same way as would a dry pad of sterilised gauze.Under this scab the formation of granulation tissue, its transformation into cicatricial tissue, and the growth of epithelium on the surface, go on until in the course of time the crust separates, leaving a scar.
describe: Skin and Connective Tissue|REPAIR IN INDIVIDUAL TISSUES  Skin and Connective Tissue.The mode of regeneration of these tissues under aseptic conditions has already been described as the type of ideal repair.In highly vascular parts, such as the face, the reparative process goes on with great rapidity, and even extensive wounds may be firmly united in from three to five days.Where the anastomosis is less free the process is more prolonged.The more highly organised elements of the skin, such as the hair follicles, the sweat and sebaceous glands, are imperfectly reproduced; hence the scar remains smooth, dry, and hairless.Epithelium.
describe: Nerve Tissues|Nerve Tissues.There is no trustworthy evidence that regeneration of the tissues of the brain or spinal cord in man ever takes place.Any loss of substance is replaced by cicatricial tissue.The repair of  Bone ,  Blood Vessels , and  Peripheral Nerves  is more conveniently considered in the chapters dealing with these structures.Rate of Healing.While the rate at which wounds heal is remarkably constant there are certain factors that influence it in one direction or the other.
describe: Preservation of Tissues|Preservation of Tissues for Grafting.It was at one time believed that tissues might be taken from the operating theatre and kept in cold storage until they were required.It is now agreed that tissues which have been separated from the body for some time inevitably lose their vitality, become incapable of regeneration, and are therefore unsuited for grafting purposes.If it is intended to preserve a portion of tissue for future grafting, it should be embedded in the subcutaneous tissue of the abdominal wall until it is wanted; this has been carried out with portions of costal cartilage and of bone.INDIVIDUAL TISSUES AS GRAFTS  The Blood  lends itself in an ideal manner to transplantation, or, as it has long been called,  transfusion .Being always a homoplastic transfer, the new blood is not always tolerated by the old, in which case biochemical changes occur, resulting in hamolysis, which corresponds to the disintegration of other unsuccessful homoplastic grafts.
describe: Transfusion|"(See article on Transfusion,  Op.Surg., p.37.)The Skin.The skin was the first tissue to be used for grafting purposes, and it is still employed with greater frequency than any other, as lesions causing defects of skin are extremely common and without the aid of grafts are tedious in healing.Transfusion of blood is most valuable as  a preliminary to operation  in patients who are bloodless as a result of hamorrhage from gastric and duodenal ulcers, and in bleeders.HAMOPHILIA The term hamophilia is applied to an inherited disease which renders the patient liable to serious hamorrhage from even the most trivial injuries; and the subjects of it are popularly known as ""bleeders.""The cause of the disease and its true nature are as yet unknown.There is no proof of any structural defect in the blood vessels, and beyond the fact that there is a diminution in the number of blood-plates, it has not been demonstrated that there is any alteration in the composition of the blood.The affection is in a marked degree hereditary, all the branches of an affected family being liable to suffer.Its mode of transmission to individuals, moreover, is characteristic: the male members of the stock alone suffer from the affection in its typical form, while the tendency is transmitted through the female line."
describe: pinal canal|"The serum may be introduced directly into a vein, or into the spinal canal,  e.g.anti-tetanic serum.The immunity produced by injections of antitoxic sera lasts only for a comparatively short time, seldom longer than a few weeks.""Serum Disease"" and Anaphylaxis.It is to be borne in mind that some patients exhibit a supersensitiveness with regard to protective sera, an injection being followed in a few days by the appearance of an urticarial or erythematous rash, pain and swelling of the joints, and a variable degree of fever.These symptoms, to which the name  serum disease  is applied, usually disappear in the course of a few days."
describe: Staphylococcus Aureus|Staphylococcus Aureus.This is the commonest organism found in localised inflammatory and suppurative conditions.It varies greatly in its virulence, and is found in such widely different conditions as skin pustules, boils, carbuncles, and some acute inflammations of bone.As seen by the microscope it occurs in grape-like clusters, fission of the individual cells taking place irregularly (Fig.2).When grown in artificial media, the colonies assume an orange-yellow colour hence the name  aureus .INFECTIONS THROUGH THE BLOOD-STREAM  Diseases caused by the Staphylococcus Aureus.As the majority of pyogenic diseases are due to infection with the staphylococcus aureus, these will be described first.Acute osteomyelitis  is a suppurative process beginning in the marrow and tending to spread to the periosteum.The disease is common in children, but is rare after the skeleton has attained maturity.Boys are affected more often than girls, in the proportion of three to one, probably because they are more liable to exposure, to injury, and to violent exertion.Etiology.
describe: Streptococcus Pyogenes|Streptococcus Pyogenes.This organism also varies greatly in its virulence; in some instances for example in erysipelas it causes a sharp attack of acute spreading inflammation, which soon subsides without showing any tendency to end in suppuration; under other conditions it gives rise to a generalised infection which rapidly proves fatal.The streptococcus has less capacity of liquefying the tissues than the staphylococcus, so that pus formation takes place more slowly.At the same time its products are very potent in destroying the tissues in their vicinity, and so interfering with the exudation of leucocytes which would otherwise exercise their protective influence.Streptococci invade the lymph spaces, and are associated with acute spreading conditions such as phlegmonous or erysipelatous inflammations and suppurations, lymphangitis and suppuration in lymph glands, and inflammation of serous and synovial membranes, also with a form of pneumonia which is prone to follow on severe operations in the mouth and throat.Streptococci are also concerned in the production of spreading gangrene and pyamia.
describe: Bacillus Coli Communis|Bacillus Coli Communis.This organism, which is a normal inhabitant of the intestinal tract, shows a great tendency to invade any organ or tissue whose vitality is lowered.It is causatively associated with such conditions as peritonitis and peritoneal suppuration resulting from strangulated hernia, appendicitis, or perforation in any part of the alimentary canal.In cystitis, pyelitis, abscess of the kidney, suppuration in the bile-ducts or liver, and in many other abdominal conditions, it plays a most important part.The discharge from wounds infected by this organism has usually a fœtid, or even a facal odour, and often contains gases resulting from putrefaction.It is a small rod-shaped organism with short flagella, which render it motile (Fig.
describe: Bacillus Typhosus|Bacillus Typhosus.This organism has been found in pure culture in suppurative conditions of bone, of cellular tissue, and of internal organs, especially during convalescence from typhoid fever.Like the staphylococcus, it is capable of lying latent in the tissues for long periods.Other Pyogenic Bacteria.It is not necessary to do more than name some of the other organisms that are known to be pyogenic, such as the bacillus pyocyaneus, which is found in green and blue pus, the micrococcus tetragenus, the gonococcus, actinomyces, the glanders bacillus, and the tubercle bacillus.Most of these will receive further mention in connection with the diseases to which they give rise.
describe: micrococcus|It is not necessary to do more than name some of the other organisms that are known to be pyogenic, such as the bacillus pyocyaneus, which is found in green and blue pus, the micrococcus tetragenus, the gonococcus, actinomyces, the glanders bacillus, and the tubercle bacillus.Most of these will receive further mention in connection with the diseases to which they give rise.Leucocytosis.Most bacterial diseases, as well as certain other pathological conditions, are associated with an increase in the number of leucocytes in the blood throughout the circulatory system.This condition of the blood, which is known as  leucocytosis , is believed to be due to an excessive output and rapid formation of leucocytes by the bone marrow, and it probably has as its object the arrest and destruction of the invading organisms or toxins.To increase the resisting power of the system to pathogenic organisms, an artificial leucocytosis may be induced by subcutaneous injection of a solution of nucleinate of soda (16 minims of a 5 per cent.
describe: Glycogen Reaction|"The Iodine or Glycogen Reaction.The leucocyte count may be supplemented by staining films of the blood with a watery solution of iodine and potassium iodide.In all advancing purulent conditions, in septic poisonings, in pneumonia, and in cancerous growths associated with ulceration, a certain number of the polynuclear leucocytes are stained a brown or reddish-brown colour, due to the action of the iodine on some substance in the cells of the nature of glycogen.This reaction is absent in serous effusions, in unmixed tuberculous infections, in uncomplicated typhoid fever, and in the early stages of cancerous growths.CHAPTER III INFLAMMATION

Definition Nature of inflammation from surgical point of     view Sequence of changes in bacterial inflammation Clinical     aspects of inflammation General principles of treatment Chronic     inflammation.Inflammation may be defined as the series of vital changes that occurs in the tissues in response to irritation."
describe: nflammation|These changes are common to the processes of inflammation and repair; no hard-and-fast line can be drawn between these processes, and the two may go on together.It is, however, only when the proliferative changes have come to predominate that the reparative process is effectively established by the production of healthy granulation tissue.Formation of Granulation Tissue.When a wound is made in the integument under aseptic conditions, the passage of the knife through the tissues is immediately followed by an oozing of blood, which soon coagulates on the cut surfaces.In each of the divided vessels a clot forms, and extends as far as the nearest collateral branch; and on the surface of the wound there is a microscopic layer of bruised and devitalised tissue.If the wound is closed, the narrow space between its edges is occupied by blood-clot, which consists of red and white corpuscles mixed with a quantity of fibrin, and this forms a temporary uniting medium between the divided surfaces.PYOGENIC BACTERIA From the point of view of the surgeon the most important varieties of micro-organisms are those that cause inflammation and suppuration the  pyogenic bacteria .This group includes a great many species, and these are so widely distributed that they are to be met with under all conditions of everyday life.The nature of the inflammatory and suppurative processes will be considered in detail later; suffice it here to say that they are brought about by the action of one or other of the organisms that we have now to consider.It is found that the  staphylococci , which cluster into groups, tend to produce localised lesions; while the chain-forms  streptococci  give rise to diffuse, spreading conditions.Many varieties of pyogenic bacteria have now been differentiated, the best known being the staphylococcus aureus, the streptococcus, and the bacillus coli communis.Staphylococcus Aureus.
describe: hamorrhagic|Thus it may be  serous , as in some forms of synovitis;  sero-fibrinous , as in certain varieties of peritonitis, the fibrin tending to limit the spread of the inflammation by forming adhesions;  croupous , when it coagulates on a free surface and forms a false membrane, as in diphtheria;  hamorrhagic  when mixed with blood; or  purulent , when suppuration has occurred.The protective effects of the inflammatory reaction depend for the most part upon the transudation of lymph and the emigration of leucocytes.The lymph contains the opsonins which act on the bacteria and render them less able to resist the attack of the phagocytes, as well as the various protective antibodies which neutralise the toxins.The polymorph leucocytes are the principal agents in the process of phagocytosis (p. 22), and together with the other forms of phagocytes they ingest and destroy the bacteria.If the attempt to repel the invading organisms is successful, the irritant effects are overcome, the inflammation is arrested, and  resolution  is said to take place.Certain of the vascular and cellular changes are now utilised to restore the condition to the normal, and  repair  ensues after the manner already described.
describe: General Treatment|General Treatment.The patient should be kept at rest, preferably in bed, to diminish the general tissue waste; and the diet should be restricted to fluids, such as milk, beef-tea, meat juices or gruel, and these may be rendered more easily assimilable by artificial digestion if necessary.To counteract the general effect of toxins absorbed into the circulation, specific antitoxic sera are employed in certain forms of infection, such as diphtheria, streptococcal septicamia, and tetanus.In other forms of infection, vaccines are employed to increase the opsonic power of the blood.When such means are not available, the circulating toxins may to some extent be diluted by giving plenty of bland fluids by the mouth or normal salt solution by the rectum.The elimination of the toxins is promoted by securing free action of the emunctories.
describe: amœboid movement|"These act as phagocytes, their function being to remove the red corpuscles and fibrin of the original clot, and this performed, they either pass back into the circulation in virtue of their amœboid movement, or are themselves eaten up by the growing fibroblasts.Beyond this phagocytic action, they do not appear to play any direct part in the reparative process.These young capillary loops, with their supporting cells and fluids, constitute granulation tissue, which is usually fully formed in from three to five days, after which it begins to be replaced by cicatricial or scar tissue.Formation of Cicatricial Tissue.The transformation of this temporary granulation tissue into scar tissue is effected by the fibroblasts, which become elongated and spindle-shaped, and produce in and around them a fine fibrillated material which gradually increases in quantity till it replaces the cell protoplasm.In this way white fibrous tissue is formed, the cells of which are arranged in parallel lines and eventually become grouped in bundles, constituting fully formed white fibrous tissue.If a film of fresh pus is examined under the microscope, the pus cells are seen to have a well-defined rounded outline, and to contain a finely granular protoplasm and a multi-partite nucleus; if still warm, the cells may exhibit amœboid movement.In stained films the nuclei take the stain well.In older pus cells the outline is irregular, the protoplasm coarsely granular, and the nuclei disintegrated, no longer taking the stain.Variations from Typical Pus.Pus from old-standing sinuses is often watery in consistence (ichorous), with few cells.Where the granulations are vascular and bleed easily, it becomes sanious from admixture with red corpuscles; while, if a blood-clot be broken down and the debris mixed with the pus, it contains granules of blood pigment and is said to be ""grumous."""
describe: Typical Pus|"Variations from Typical Pus.Pus from old-standing sinuses is often watery in consistence (ichorous), with few cells.Where the granulations are vascular and bleed easily, it becomes sanious from admixture with red corpuscles; while, if a blood-clot be broken down and the debris mixed with the pus, it contains granules of blood pigment and is said to be ""grumous.""The  odour  of pus varies with the different bacteria producing it.Pus due to ordinary pyogenic cocci has a mawkish odour; when putrefactive organisms are present it has a putrid odour; when it forms in the vicinity of the intestinal canal it usually contains the bacillus coli communis and has a facal odour.The  colour  of pus also varies: when due to one or other of the varieties of the bacillus pyocyaneus, it is usually of a blue or green colour; when mixed with bile derivatives or altered blood pigment, it may be of a bright orange colour."
describe: Acute Circumscribed Abscess|Clinical Features of an Acute Circumscribed Abscess.In the initial stages the usual symptoms of inflammation are present.Increased elevation of temperature, with or without a rigor, progressive leucocytosis, and sweating, mark the transition between inflammation and suppuration.An increasing leucocytosis is evidence that a suppurative process is spreading.The local symptoms vary with the seat of the abscess.When it is situated superficially for example, in the breast tissue the affected area is hot, the redness of inflammation gives place to a dusky purple colour, with a pale, sometimes yellow, spot where the pus is near the surface.
describe: anti-streptococcic|The general treatment of toxamia must be carried out, and in cases due to infection by streptococci, anti-streptococcic serum may be used.In a few cases, amputation well above the seat of disease, by removing the source of toxin production, offers the only means of saving the patient.WHITLOW The clinical term whitlow is applied to an acute infection, usually followed by suppuration, commonly met with in the fingers, less frequently in the toes.The point of infection is often trivial a pin-prick, a puncture caused by a splinter of wood, a scratch, or even an imperceptible lesion of the skin.Several varieties of whitlow are recognised, but while it is convenient to describe them separately, it is to be clearly understood that clinically they merge one into another, and it is not always possible to determine in which connective-tissue plane a given infection has originated.Initial Stage.It is worthy of note that the anti-streptococcic serum has proved of less value in the treatment of erysipelas than might have been expected, probably because the serum is not made from the proper strain of streptococcus.It is not necessary to isolate cases of erysipelas, provided the usual precautions against carrying infection from one patient to another are rigidly carried out.DIPHTHERIA Diphtheria is an acute infective disease due to the action of a specific bacterium, the  bacillus diphtheria  or  Klebs-Löffler bacillus .The disease is usually transmitted from one patient to another, but it may be contracted from cats, fowls, or through the milk of infected cows.Cases have occurred in which the surgeon has carried the infection from one patient to another through neglect of antiseptic precautions.The incubation period varies from two to seven days.
describe: Initial Stage|Initial Stage.Attention is usually first attracted to the condition by a sensation of tightness in the finger and tenderness when the part is squeezed or knocked against anything.In the course of a few hours the part becomes red and swollen; there is continuous pain, which soon assumes a throbbing character, particularly when the hand is dependent, and may be so severe as to prevent sleep, and the patient may feel generally out of sorts.If a constricting band is applied at this stage, the infection can usually be checked and the occurrence of suppuration prevented.If this fails, or if the condition is allowed to go untreated, the inflammatory reaction increases and terminates in suppuration, giving rise to one or other of the forms of whitlow to be described.The Purulent Blister.
