question|answer
Where is New York City located ?|New York City is located at the southern tip of New York State. It constitutes the geographical and demographic center of both the Northeast megalopolis and the New York metropolitan area
Where is New York City| New York City is located at the southern tip of New York State. It constitutes the geographical and demographic center of both the Northeast megalopolis and the New York metropolitan area
Where is New York| New York City is located at the southern tip of New York State. It constitutes the geographical and demographic center of both the Northeast megalopolis and the New York metropolitan area
What is the population of New York ?| The population of New York City as of 2020 is 8,804,190 distributed over 300.46 square miles (778.2 km2)
population of New York ?|The population of New York City as of 2020 is 8,804,190 distributed over 300.46 square miles (778.2 km2)
New York population|The population of New York City as of 2020 is 8,804,190 distributed over 300.46 square miles (778.2 km2)
New York City population|The population of New York City as of 2020 is 8,804,190 distributed over 300.46 square miles (778.2 km2)
Where is United Nations located ?|United Nations is located in New York City.
Which is the second largest city in the Unites States ?|Los Angels is the second largest city in New York
second largest city in the Unites States ?|Los Angels is the second largest city in New York